{"final_prose":{"paragraphs":[{"avg_sentence_length":14.142857142857142,"canon_refs":[],"emotion":"joy","intensity":0.4,"motif_refs":["SEED-001-dd21a0","SEED-002-21a026","SEED-004-26d8d4"],"paragraph_id":"PARA-2d2d728b68b1","rhetorical_devices":["anaphora"],"segment_ids":["SEG-9ec1ede164a6","SEG-b74e33c488bf","SEG-b3dde8a29545","SEG-7a8cc6c97fe5","SEG-220b8a410cb2","SEG-614d94a39a92","SEG-0fcc1d5291d1"],"sensory_anchors":["Anchored to: The village of Horlogis exists in a temporal anomaly where each person experiences time at a different speed","ambient-fce38058"],"sentence_count":7,"text":"Advance conformity — stage 1/4 — Establish societal conflict context. Escalate tension through societal confrontation — Raise tension through escalating action, and the moment stretched further, yielding to quiet contemplation. Character responds to societal pressure — Show character response to pressure, and the moment stretched further, yielding to quiet contemplation. Revelation shifts understanding of Advance conformity — stage 1/4. Consequence of societal conflict manifests — Demonstrate consequences of prior actions, and the moment stretched further, yielding to quiet contemplation. Internal reaction to societal situation — Deepen character through internal reaction. Pivot toward resolution of scene objective — intention: Shift.","word_count":99},{"avg_sentence_length":8.6,"canon_refs":[],"emotion":"joy","intensity":0.4,"motif_refs":["SEED-001-dd21a0","SEED-002-21a026","SEED-005-d8d43f"],"paragraph_id":"PARA-77fffb015591","rhetorical_devices":[],"segment_ids":["SEG-92e2ee82621e","SEG-6dda3170cc28","SEG-bded8bdfe017","SEG-ae33d44e7f82","SEG-T-6a5c90266755"],"sensory_anchors":["Anchored to: The village of Horlogis exists in a temporal anomaly where each person experiences time at a different speed","ambient-fce38058"],"sentence_count":5,"text":"Climactic beat: societal conflict peaks — Deliver peak emotional. Establish societal conflict context — Establish stakes and context for the reader. Escalate tension through societal confrontation — Raise tension through. Character responds to societal pressure — withholds: Withheld from. From SCN-01-001-857d86 to SCN-01-002-50de0e.","word_count":43},{"avg_sentence_length":13.6,"canon_refs":[],"emotion":"anticipation","intensity":0.48,"motif_refs":["SEED-002-21a026","SEED-001-dd21a0","SEED-004-26d8d4"],"paragraph_id":"PARA-ffd88f3dc3a4","rhetorical_devices":["chiasmus","anaphora"],"segment_ids":["SEG-660182fecc01","SEG-c4a2f9be7514","SEG-7241b002e94a","SEG-c1ad1c52fd35","SEG-b1f0b1110458"],"sensory_anchors":["Anchored to: The village of Horlogis exists in a temporal anomaly where each person experiences time at a different speed","ambient-fce38058"],"sentence_count":5,"text":"Establish societal conflict context — reveals: Key info for SCN-01-002-50de0e beat 1. Escalate tension through societal confrontation — Raise tension through escalating action, and the moment stretched further, yielding to quiet contemplation. Character responds to societal pressure — Show character response to pressure. Revelation shifts understanding of Advance conformity — stage 2/4 — Reveal new information that changes dynamics. Consequence of societal conflict manifests — intention: Demonstrate consequences.","word_count":68},{"avg_sentence_length":10.75,"canon_refs":[],"emotion":"anticipation","intensity":0.48,"motif_refs":["SEED-002-21a026","SEED-001-dd21a0"],"paragraph_id":"PARA-508813dcbe84","rhetorical_devices":[],"segment_ids":["SEG-f5d63b43e8de","SEG-31fd07ca274a","SEG-22b7c05f362a","SEG-T-e8af29664b8a"],"sensory_anchors":["Anchored to: The village of Horlogis exists in a temporal anomaly where each person experiences time at a different speed","ambient-fce38058"],"sentence_count":4,"text":"Internal reaction to societal situation — Deepen character through. Pivot toward resolution of scene objective — Shift narrative toward scene resolution, and the moment stretched further, yielding to quiet contemplation. Climactic beat: societal conflict peaks — withholds: Withheld from. From SCN-01-002-50de0e to SCN-01-003-243539.","word_count":43},{"avg_sentence_length":8.333333333333334,"canon_refs":[],"emotion":"anticipation","intensity":0.63,"motif_refs":["SEED-003-a026d8","SEED-001-dd21a0"],"paragraph_id":"PARA-0c59f9c2aab2","rhetorical_devices":["chiasmus"],"segment_ids":["SEG-75114b343fe3","SEG-ba591e6716ce","SEG-T-6ae4490f9055"],"sensory_anchors":["Anchored to: The village of Horlogis exists in a temporal anomaly where each person experiences time at a different speed","ambient-fce38058"],"sentence_count":3,"text":"Establish existential conflict context — reveals: Key info for SCN-01-003-243539 beat 1. Escalate tension through existential confrontation — withholds: Withheld from. From SCN-01-003-243539 to SCN-01-004-f6fdeb.","word_count":25},{"avg_sentence_length":12,"canon_refs":[],"emotion":"anger","intensity":0.63,"motif_refs":["SEED-004-26d8d4","SEED-002-21a026","SEED-001-dd21a0"],"paragraph_id":"PARA-7118b989a3ec","rhetorical_devices":["chiasmus","anaphora"],"segment_ids":["SEG-abf3b68c45a9","SEG-dae3c02063d9","SEG-980f6cdb6764","SEG-d628e6bf7c31","SEG-49ee729cfed1","SEG-ec21623f8b41"],"sensory_anchors":["Anchored to: The village of Horlogis exists in a temporal anomaly where each person experiences time at a different speed","ambient-fce38058"],"sentence_count":6,"text":"Establish internal conflict context — reveals: Key info for SCN-01-004-f6fdeb beat 1. Escalate tension through internal confrontation — Raise tension through escalating action. Character responds to internal pressure — Show character response to pressure. Revelation shifts understanding of Advance conformity — stage 4/4. Consequence of internal conflict manifests — Demonstrate consequences of prior actions, and the moment stretched further, yielding to quiet contemplation. Internal reaction to internal situation — intention: Deepen character.","word_count":72},{"avg_sentence_length":13,"canon_refs":[],"emotion":"anger","intensity":0.63,"motif_refs":["SEED-004-26d8d4","SEED-001-dd21a0","SEED-005-d8d43f"],"paragraph_id":"PARA-a010ed13d1d1","rhetorical_devices":["epistrophe"],"segment_ids":["SEG-7e761c665eae","SEG-a87e42872b04","SEG-4728f7d8b3fc"],"sensory_anchors":["Anchored to: The village of Horlogis exists in a temporal anomaly where each person experiences time at a different speed","ambient-fce38058"],"sentence_count":3,"text":"Pivot toward resolution of scene objective — Shift narrative toward scene resolution, and the moment stretched further, yielding to quiet contemplation. Climactic beat: internal conflict peaks — Deliver peak emotional. Establish internal conflict context — Establish stakes and context.","word_count":39},{"avg_sentence_length":10.25,"canon_refs":[],"emotion":"anger","intensity":0.63,"motif_refs":["SEED-005-d8d43f","SEED-001-dd21a0","SEED-002-21a026"],"paragraph_id":"PARA-c8378bc09d44","rhetorical_devices":["anaphora"],"segment_ids":["SEG-e497c1b4da3e","SEG-4ecc06ae05d5","SEG-910a37a56e05","SEG-8cdd3fa8a23f"],"sensory_anchors":["Anchored to: The village of Horlogis exists in a temporal anomaly where each person experiences time at a different speed","ambient-fce38058"],"sentence_count":4,"text":"Advance sacrifice — stage 1/2 — Establish existential conflict context. Escalate tension through existential confrontation — Raise tension through escalating action. Character responds to existential pressure — Show character response to pressure. Revelation shifts understanding of Advance sacrifice — stage 1/2.","word_count":41},{"avg_sentence_length":6.5,"canon_refs":[],"emotion":"anger","intensity":0.63,"motif_refs":["SEED-005-d8d43f","SEED-001-dd21a0"],"paragraph_id":"PARA-aa45484385ca","rhetorical_devices":[],"segment_ids":["SEG-1df00402de38","SEG-T-41a775314884"],"sensory_anchors":["Anchored to: The village of Horlogis exists in a temporal anomaly where each person experiences time at a different speed","ambient-fce38058"],"sentence_count":2,"text":"Consequence of existential conflict manifests — withholds: Withheld from. From SCN-02-001-d16386 to SCN-02-002-02eda0.","word_count":13},{"avg_sentence_length":12.5,"canon_refs":[],"emotion":"sadness","intensity":0.7,"motif_refs":["SEED-003-a026d8","SEED-004-26d8d4","SEED-005-d8d43f","SEED-001-dd21a0","SEED-002-21a026"],"paragraph_id":"PARA-86e20cf4c365","rhetorical_devices":["chiasmus","anaphora"],"segment_ids":["SEG-b696aed0bb2c","SEG-11a3e1a1de59","SEG-64b09c9bfb18","SEG-abe146758b73"],"sensory_anchors":["Anchored to: The village of Horlogis exists in a temporal anomaly where each person experiences time at a different speed","ambient-fce38058"],"sentence_count":4,"text":"Establish societal conflict context — reveals: Key info for SCN-02-002-02eda0 beat 1. Escalate tension through societal confrontation — Raise tension through escalating action, and the moment stretched further, yielding to quiet contemplation. Character responds to societal pressure — Show character response. Revelation shifts understanding of Advance sacrifice — stage 2/2.","word_count":50},{"avg_sentence_length":9,"canon_refs":[],"emotion":"sadness","intensity":0.7,"motif_refs":["SEED-001-dd21a0"],"paragraph_id":"PARA-6afe4cdf5857","rhetorical_devices":["epistrophe"],"segment_ids":["SEG-f54ea4da203b"],"sensory_anchors":["Anchored to: The village of Horlogis exists in a temporal anomaly where each person experiences time at a different speed","ambient-fce38058"],"sentence_count":1,"text":"Consequence of societal conflict manifests — Demonstrate consequences of.","word_count":9}],"pass_number":0,"prose_hash":"89aee4f88fcfc268ed52fcc9ff5bf278c6a7c2c9f3dbc6615bad83592366a793","prose_id":"PROSE-89aee4f88fcfc268","skeleton_id":"SKEL-dae07f58fbec505d","total_sentence_count":44,"total_word_count":502},"gate_result":{"first_failure":"STYLE_GATE","gate_results":[{"gate_id":"TRUTH_GATE","metrics":{"canon_entries":6,"total_paragraphs":11,"unsupported_count":0},"timestamp_deterministic":"2026-01-01T00: